{
  "coverage": {
    "by_category_bytes": {
      "compressed_candidates": 24,
      "header": 192,
      "table_records": 344
    },
    "category_note": "Categorías pueden solaparse; classified_bytes usa unión de intervalos.",
    "classified_bytes": 560,
    "classified_ranges": [
      [
        0,
        192
      ],
      [
        512,
        616
      ],
      [
        768,
        936
      ],
      [
        1280,
        1352
      ],
      [
        1793,
        1802
      ],
      [
        1825,
        1834
      ],
      [
        1857,
        1863
      ]
    ],
    "denominator_bytes": 4096,
    "duplicated_classification_bytes": 0,
    "overlap_bytes": 0,
    "overlap_ranges": [],
    "unknown_bytes": 3536,
    "unknown_ranges": [
      [
        192,
        512
      ],
      [
        616,
        768
      ],
      [
        936,
        1280
      ],
      [
        1352,
        1793
      ],
      [
        1802,
        1825
      ],
      [
        1834,
        1857
      ],
      [
        1863,
        4096
      ]
    ]
  },
  "entities": [
    {
      "address": null,
      "confidence": "heuristic",
      "data": {
        "game_code_hint": "BE8E",
        "profile": "fe8-us"
      },
      "evidence": [
        "header-game-code",
        "unknown-variant"
      ],
      "extractor_version": "0.3.0",
      "game": "fe8-us",
      "id": "air:bd48ae65303eeeea99b49eb149b470e07669380f0bf9e9094630c96565a400c5",
      "key": "fe8-us",
      "kind": "Game",
      "offset": null,
      "parser": "gba-header",
      "references": [],
      "schema_version": "1.0.0",
      "sha256": null,
      "size_bytes": 0,
      "unknown_fields": [
        "campaign",
        "mechanics"
      ],
      "validation": "inferred",
      "variant": "b766051839f1f9aa68b52c6440b6bc4f61b6b1e34be3c99b440bbbbcb4f4a640"
    },
    {
      "address": null,
      "confidence": "exact",
      "data": {
        "crc32": "35172f29",
        "sha1": "a09f9f10b69a57114d756f32ae2cf511b6130de4"
      },
      "evidence": [
        "whole-file-hashes"
      ],
      "extractor_version": "0.3.0",
      "game": "fe8-us",
      "id": "air:84adf3aa13300045c2dd5421eda4b883e6c01c1e58712a019c0f5acc19c0a542",
      "key": "b766051839f1f9aa68b52c6440b6bc4f61b6b1e34be3c99b440bbbbcb4f4a640",
      "kind": "ROMVariant",
      "offset": null,
      "parser": "gba-header",
      "references": [],
      "schema_version": "1.0.0",
      "sha256": "b766051839f1f9aa68b52c6440b6bc4f61b6b1e34be3c99b440bbbbcb4f4a640",
      "size_bytes": 0,
      "unknown_fields": [],
      "validation": "confirmed",
      "variant": "b766051839f1f9aa68b52c6440b6bc4f61b6b1e34be3c99b440bbbbcb4f4a640"
    },
    {
      "address": 134217728,
      "confidence": "documented",
      "data": {
        "type": "header"
      },
      "evidence": [
        "fixed-size-header",
        "checksum-calculation"
      ],
      "extractor_version": "0.3.0",
      "game": "fe8-us",
      "id": "air:0c890874e20eb25a2e02e1ff6403732eb6cce2503459b924a0a73667d97f5a3e",
      "key": "cartridge-header",
      "kind": "Asset",
      "offset": 0,
      "parser": "gba-header",
      "references": [],
      "schema_version": "1.0.0",
      "sha256": "15be0699cc3b1bf874b86a6b67d365238a7eb080af4cedc4f66bc4a43d11389e",
      "size_bytes": 192,
      "unknown_fields": [
        "entrypoint_semantics"
      ],
      "validation": "structural",
      "variant": "b766051839f1f9aa68b52c6440b6bc4f61b6b1e34be3c99b440bbbbcb4f4a640"
    },
    {
      "address": 134218240,
      "confidence": "heuristic",
      "data": {
        "affinity": 0,
        "attributes": 0,
        "base_constitution": 0,
        "base_defense": 0,
        "base_hp": -2,
        "base_level": 3,
        "base_luck": 0,
        "base_power": 0,
        "base_resistance": 0,
        "base_skill": 0,
        "base_speed": 0,
        "class_id": 1,
        "description_text_id": 200,
        "growth_defense": 0,
        "growth_hp": 41,
        "growth_luck": 0,
        "growth_power": 0,
        "growth_resistance": 0,
        "growth_skill": 0,
        "growth_speed": 0,
        "mini_portrait_id": 0,
        "name_text_id": 100,
        "number": 1,
        "pointer_evidence": [],
        "portrait_id": 0,
        "slot": 0,
        "sort_order": 0,
        "support_pointer": 0,
        "table_index": 1,
        "visit_group": 0,
        "warnings": [],
        "weapon_ranks": [
          0,
          0,
          0,
          0,
          0,
          0,
          0,
          0
        ]
      },
      "evidence": [
        "https://github.com/FireEmblemUniverse/fireemblem8u/blob/f2e1f060dbe5b0cc35285df5a0f6659860644a04/include/bmunit.h",
        "table-definition-sha256:d474785aa2c9095476edd31a017a663ea6154478e617d63e904ceb94d2427b97",
        "bounded-little-endian-read",
        "synthetic-generated-by-ArcanaCart; not a commercial ROM"
      ],
      "extractor_version": "0.3.0",
      "game": "fe8-us",
      "id": "air:09289d457b9e3573abf5bf61589d3bb72fb0069ed640bcc3912f578a1b8b17b1",
      "key": "1",
      "kind": "Character",
      "offset": 512,
      "parser": "fe8-us/Character",
      "references": [
        "air:8f8fe25023110a88fca8e2c3121959cd1e90ce3a655713d1f5a24957757f8f97"
      ],
      "schema_version": "1.0.0",
      "sha256": "d2d2b6a29518eee19bf2f66909b368f7fbfec3bafd0c33d4cd26e70aace9ed02",
      "size_bytes": 52,
      "unknown_fields": [
        "inventory",
        "support_relationships",
        "decoded_text",
        "recruitment",
        "reserved_bytes"
      ],
      "validation": "inferred",
      "variant": "b766051839f1f9aa68b52c6440b6bc4f61b6b1e34be3c99b440bbbbcb4f4a640"
    },
    {
      "address": 134218292,
      "confidence": "heuristic",
      "data": {
        "affinity": 0,
        "attributes": 0,
        "base_constitution": 0,
        "base_defense": 0,
        "base_hp": -2,
        "base_level": 4,
        "base_luck": 0,
        "base_power": 0,
        "base_resistance": 0,
        "base_skill": 0,
        "base_speed": 0,
        "class_id": 1,
        "description_text_id": 201,
        "growth_defense": 0,
        "growth_hp": 42,
        "growth_luck": 0,
        "growth_power": 0,
        "growth_resistance": 0,
        "growth_skill": 0,
        "growth_speed": 0,
        "mini_portrait_id": 0,
        "name_text_id": 101,
        "number": 2,
        "pointer_evidence": [],
        "portrait_id": 0,
        "slot": 1,
        "sort_order": 0,
        "support_pointer": 0,
        "table_index": 2,
        "visit_group": 0,
        "warnings": [],
        "weapon_ranks": [
          0,
          0,
          0,
          0,
          0,
          0,
          0,
          0
        ]
      },
      "evidence": [
        "https://github.com/FireEmblemUniverse/fireemblem8u/blob/f2e1f060dbe5b0cc35285df5a0f6659860644a04/include/bmunit.h",
        "table-definition-sha256:d474785aa2c9095476edd31a017a663ea6154478e617d63e904ceb94d2427b97",
        "bounded-little-endian-read",
        "synthetic-generated-by-ArcanaCart; not a commercial ROM"
      ],
      "extractor_version": "0.3.0",
      "game": "fe8-us",
      "id": "air:f5ab810a85c1aad9d9fe471dc5553ace947c798d03559e8ed2dc3de3ec108cea",
      "key": "2",
      "kind": "Character",
      "offset": 564,
      "parser": "fe8-us/Character",
      "references": [
        "air:8f8fe25023110a88fca8e2c3121959cd1e90ce3a655713d1f5a24957757f8f97"
      ],
      "schema_version": "1.0.0",
      "sha256": "30b9628b32e42a4fbcc63aa7dd51cf4c56f5b825336ed7be7ac91d472bd926c8",
      "size_bytes": 52,
      "unknown_fields": [
        "inventory",
        "support_relationships",
        "decoded_text",
        "recruitment",
        "reserved_bytes"
      ],
      "validation": "inferred",
      "variant": "b766051839f1f9aa68b52c6440b6bc4f61b6b1e34be3c99b440bbbbcb4f4a640"
    },
    {
      "address": 134218496,
      "confidence": "heuristic",
      "data": {
        "animation_pointer": 0,
        "attributes": 0,
        "base_constitution": 0,
        "base_defense": 0,
        "base_hp": 0,
        "base_movement": 5,
        "base_power": 0,
        "base_resistance": 0,
        "base_skill": 0,
        "base_speed": 0,
        "description_text_id": 200,
        "growth_defense": 0,
        "growth_hp": 0,
        "growth_luck": 0,
        "growth_power": 0,
        "growth_resistance": 0,
        "growth_skill": 0,
        "growth_speed": 0,
        "map_sprite_id": 0,
        "max_constitution": 0,
        "max_defense": 0,
        "max_hp": 61,
        "max_power": 0,
        "max_resistance": 0,
        "max_skill": 0,
        "max_speed": 0,
        "movement_pointers": [
          0,
          0,
          0
        ],
        "name_text_id": 100,
        "number": 1,
        "pointer_evidence": [],
        "portrait_id": 0,
        "promotion_bonus_defense": 0,
        "promotion_bonus_hp": 0,
        "promotion_bonus_power": 0,
        "promotion_bonus_resistance": 0,
        "promotion_bonus_skill": 0,
        "promotion_bonus_speed": 0,
        "promotion_id": 2,
        "relative_power": 0,
        "slot": 0,
        "sort_order": 0,
        "table_index": 1,
        "terrain_avoid_pointer": 0,
        "terrain_defense_pointer": 0,
        "terrain_resistance_pointer": 0,
        "unknown_50": 0,
        "walk_speed": 0,
        "warnings": [],
        "weapon_ranks": [
          0,
          0,
          0,
          0,
          0,
          0,
          0,
          0
        ]
      },
      "evidence": [
        "https://github.com/FireEmblemUniverse/fireemblem8u/blob/f2e1f060dbe5b0cc35285df5a0f6659860644a04/include/bmunit.h",
        "table-definition-sha256:d474785aa2c9095476edd31a017a663ea6154478e617d63e904ceb94d2427b97",
        "bounded-little-endian-read",
        "synthetic-generated-by-ArcanaCart; not a commercial ROM"
      ],
      "extractor_version": "0.3.0",
      "game": "fe8-us",